{
    "userId": 70790981,
    "authorName": "Ron Polansky",
    "from": "&quot;Ron Polansky&quot; &lt;rpolansky@...&gt;",
    "profile": "ronpolansky",
    "replyTo": "LIST",
    "senderId": "f9oqtr2r2LaQrj3-ReeBHNJPAKndTN2BQngn5Qz2-wR1K93X9A-5x8jnUy2e_8sjPE0lARdwDusfItguZ95TmNENcD_Dr9XFS0-qy4svZaHJLw",
    "spamInfo": {
        "isSpam": false,
        "reason": "0"
    },
    "subject": "Goto resources",
    "postDate": "1051107955",
    "msgId": 17,
    "canDelete": false,
    "contentTrasformed": false,
    "systemMessage": false,
    "headers": {
        "messageIdInHeader": "PGI4NjdwaittdDU2QGVHcm91cHMuY29tPg=="
    },
    "prevInTopic": 0,
    "nextInTopic": 23,
    "prevInTime": 16,
    "nextInTime": 18,
    "topicId": 17,
    "numMessagesInTopic": 5,
    "msgSnippet": "Gentlemen: I have a set of koshirae that appears to have been made by a student of Goto Seijo (5th). The student is not listed in the Kinko Meikan. (info from",
    "rawEmail": "Return-Path: &lt;rpolansky@...&gt;\r\nX-Sender: rpolansky@...\r\nX-Apparently-To: nihontostudy@yahoogroups.com\r\nReceived: (EGP: mail-8_2_6_5); 23 Apr 2003 14:29:41 -0000\r\nReceived: (qmail 65920 invoked from network); 23 Apr 2003 14:26:38 -0000\r\nReceived: from unknown (66.218.66.217)\n  by m10.grp.scd.yahoo.com with QMQP; 23 Apr 2003 14:26:38 -0000\r\nReceived: from unknown (HELO n4.grp.scd.yahoo.com) (66.218.66.88)\n  by mta2.grp.scd.yahoo.com with SMTP; 23 Apr 2003 14:26:38 -0000\r\nReceived: from [66.218.67.155] by n4.grp.scd.yahoo.com with NNFMP; 23 Apr 2003 14:25:58 -0000\r\nDate: Wed, 23 Apr 2003 14:25:55 -0000\r\nTo: nihontostudy@yahoogroups.com\r\nSubject: Goto resources\r\nMessage-ID: &lt;b867pj+mt56@...&gt;\r\nUser-Agent: eGroups-EW/0.82\r\nMIME-Version: 1.0\r\nContent-Type: text/plain; charset=ISO-8859-1\r\nContent-Length: 379\r\nX-Mailer: Yahoo Groups Message Poster\r\nFrom: &quot;Ron Polansky&quot; &lt;rpolansky@...&gt;\r\nX-Yahoo-Group-Post: member; u=70790981\r\nX-Yahoo-Profile: ronpolansky\r\n\r\nGentlemen:\n\nI have a set of koshirae that appears to have been made by a student \nof Goto Seijo (5th). The student is not listed in the Kinko Meikan. \n(info from the Murtha fittings volume)\n\nIs there any English language resource on the Goto artisans that \nwould list genealogies, students etc. ?\nWhat is the best Japanese language resource on this kinko school?\n\nThanks!\nRon P.\n\n\n"
}