{
    "userId": 122856650,
    "authorName": "Richard Turner",
    "from": "&quot;Richard Turner&quot; &lt;ikkanshi@...&gt;",
    "profile": "retalt",
    "replyTo": "LIST",
    "senderId": "tQ1AjCo5PiPze49324xIizPmwT6S4pWOPOhLj0zEXEwEM9H2im5Zb4QNiS3rdOsGSLqYUEaMH8goupy6VOGKyIfIyXh0MZxVd_1drV9gsB6b",
    "spamInfo": {
        "isSpam": false,
        "reason": "0"
    },
    "subject": "Well done Jim",
    "postDate": "1051070268",
    "msgId": 2,
    "canDelete": false,
    "contentTrasformed": false,
    "systemMessage": false,
    "headers": {
        "messageIdInHeader": "PGI4NTJ2cyt2cWc1QGVHcm91cHMuY29tPg=="
    },
    "prevInTopic": 0,
    "nextInTopic": 3,
    "prevInTime": 1,
    "nextInTime": 3,
    "topicId": 2,
    "numMessagesInTopic": 2,
    "msgSnippet": "Looking forward to swod tok not politics. thanks Jim",
    "rawEmail": "Return-Path: &lt;ikkanshi@...&gt;\r\nX-Sender: ikkanshi@...\r\nX-Apparently-To: nihontostudy@yahoogroups.com\r\nReceived: (EGP: mail-8_2_6_5); 23 Apr 2003 03:57:54 -0000\r\nReceived: (qmail 50346 invoked from network); 23 Apr 2003 03:57:53 -0000\r\nReceived: from unknown (66.218.66.218)\n  by m1.grp.scd.yahoo.com with QMQP; 23 Apr 2003 03:57:53 -0000\r\nReceived: from unknown (HELO n9.grp.scd.yahoo.com) (66.218.66.93)\n  by mta3.grp.scd.yahoo.com with SMTP; 23 Apr 2003 03:57:52 -0000\r\nReceived: from [66.218.67.184] by n9.grp.scd.yahoo.com with NNFMP; 23 Apr 2003 03:57:52 -0000\r\nDate: Wed, 23 Apr 2003 03:57:48 -0000\r\nTo: nihontostudy@yahoogroups.com\r\nSubject: Well done Jim\r\nMessage-ID: &lt;b852vs+vqg5@...&gt;\r\nUser-Agent: eGroups-EW/0.82\r\nMIME-Version: 1.0\r\nContent-Type: text/plain; charset=ISO-8859-1\r\nContent-Length: 54\r\nX-Mailer: Yahoo Groups Message Poster\r\nFrom: &quot;Richard Turner&quot; &lt;ikkanshi@...&gt;\r\nX-Yahoo-Group-Post: member; u=122856650\r\nX-Yahoo-Profile: retalt\r\n\r\nLooking forward to swod tok not politics.\n\nthanks Jim\n\n\n"
}