{
    "userId": 122856650,
    "authorName": "Richard Turner",
    "from": "&quot;Richard Turner&quot; &lt;ikkanshi@...&gt;",
    "profile": "retalt",
    "replyTo": "LIST",
    "senderId": "KtWstAS9ozta_QBkVgMjXqxeiblfbnuqPHvIce1HEKRFUduOInpNeYu51SHqSQqw9qFDoQJ1kDZsejRPXmy6178qoGdcRbafEMXpZg9pq0Uk",
    "spamInfo": {
        "isSpam": false,
        "reason": "0"
    },
    "subject": "Re: [nihontostudy] Re: list stuff",
    "postDate": "1051140282",
    "msgId": 31,
    "canDelete": false,
    "contentTrasformed": false,
    "systemMessage": false,
    "headers": {
        "messageIdInHeader": "PDAwYWQwMWMzMDllZiQ4NGVjN2FiMCQwMzAwYThjMEByaWNoYXJkPg==",
        "referencesHeader": "PDIwMDMwNDIzMTUzMjU1LjY5MDMxLnFtYWlsQHdlYjQxMDExLm1haWwueWFob28uY29tPiA8MDA4ZjAxYzMwOWNlJDMzNmU4NWEwJGJiNjQzYjQxQG9lbWNvbXB1dGVyPg=="
    },
    "prevInTopic": 27,
    "nextInTopic": 0,
    "prevInTime": 30,
    "nextInTime": 32,
    "topicId": 27,
    "numMessagesInTopic": 2,
    "msgSnippet": "Jim, I f yo uwant to mail it to me, I will host it for you ( I can do this for all of you to a certain extent ) and set up a link on the main board so people",
    "rawEmail": "Return-Path: &lt;ikkanshi@...&gt;\r\nX-Sender: ikkanshi@...\r\nX-Apparently-To: nihontostudy@yahoogroups.com\r\nReceived: (EGP: mail-8_2_6_5); 23 Apr 2003 23:32:35 -0000\r\nReceived: (qmail 360 invoked from network); 23 Apr 2003 23:32:33 -0000\r\nReceived: from unknown (66.218.66.216)\n  by m3.grp.scd.yahoo.com with QMQP; 23 Apr 2003 23:32:33 -0000\r\nReceived: from unknown (HELO mail.iinet.net.au) (203.59.3.36)\n  by mta1.grp.scd.yahoo.com with SMTP; 23 Apr 2003 23:32:32 -0000\r\nReceived: (qmail 21308 invoked from network); 23 Apr 2003 23:24:56 -0000\r\nReceived: from unknown (HELO richard) (203.59.58.226)\n  by mail.iinet.net.au with SMTP; 23 Apr 2003 23:24:56 -0000\r\nMessage-ID: &lt;00ad01c309ef$84ec7ab0$0300a8c0@richard&gt;\r\nTo: &lt;nihontostudy@yahoogroups.com&gt;\r\nReferences: &lt;20030423153255.69031.qmail@...&gt; &lt;008f01c309ce$336e85a0$bb643b41@oemcomputer&gt;\r\nSubject: Re: [nihontostudy] Re: list stuff\r\nDate: Thu, 24 Apr 2003 07:24:42 +0800\r\nMIME-Version: 1.0\r\nX-Priority: 3\r\nX-MSMail-Priority: Normal\r\nX-Mailer: Microsoft Outlook Express 6.00.2800.1106\r\nX-MimeOLE: Produced By Microsoft MimeOLE V6.00.2800.1106\r\nFrom: &quot;Richard Turner&quot; &lt;ikkanshi@...&gt;\r\nX-Yahoo-Group-Post: member; u=122856650\r\nX-Yahoo-Profile: retalt\r\nContent-Type: text/plain; charset=US-ASCII\r\nContent-Transfer-Encoding: 7bit\r\n\r\nJim, I f yo uwant to mail it to me, I will host it for you ( I can do this for all of you to a certain extent ) and set up a link on the main board so people can download it in their own time.\n\nRich\n  ----- Original Message ----- \n  From: Jim Gilbert \n  To: nihontostudy@yahoogroups.com \n  Sent: Thursday, April 24, 2003 3:26 AM\n  Subject: Re: [nihontostudy] Re: list stuff\n\n\n  Bob and all,\n  Thanks.  I set up the list to not allow attachments.  I don&#39;t know if it&#39;s\n  possible to post non-photo files on the group website.  With a small group,\n  mailing out the spreadsheet individually isn&#39;t a problem.\n\n\n[Non-text portions of this message have been removed]\n\n\n"
}