{
    "userId": 70790403,
    "authorName": "Jim Gilbert",
    "from": "&quot;Jim Gilbert&quot; &lt;jggilbert@...&gt;",
    "profile": "yamaimojg",
    "replyTo": "LIST",
    "senderId": "-MHlu2DkFF-BXpFifdlD2kXuqBvFBaAXiGczQnpZ05xPxOHn577uRX4DSdQCn3HYfoLDbs4CL1UrF8EfOW1HGWht5vz7bieKkzB5URvn",
    "spamInfo": {
        "isSpam": false,
        "reason": "0"
    },
    "subject": "koshirae data file",
    "postDate": "1051146514",
    "msgId": 35,
    "canDelete": false,
    "contentTrasformed": false,
    "systemMessage": false,
    "headers": {
        "messageIdInHeader": "PDAxNTAwMWMzMDlmZSQwODQwOTgyMCRiYjY0M2I0MUBvZW1jb21wdXRlcj4="
    },
    "prevInTopic": 0,
    "nextInTopic": 36,
    "prevInTime": 34,
    "nextInTime": 36,
    "topicId": 35,
    "numMessagesInTopic": 2,
    "msgSnippet": "After Bob R. clued me in that there is a place to post non-photo files, I uploaded that Excel spreadsheet of koshirae stats to the group web site at: ",
    "rawEmail": "Return-Path: &lt;jggilbert@...&gt;\r\nX-Sender: jggilbert@...\r\nX-Apparently-To: nihontostudy@yahoogroups.com\r\nReceived: (EGP: mail-8_2_6_5); 24 Apr 2003 01:06:55 -0000\r\nReceived: (qmail 43263 invoked from network); 24 Apr 2003 01:06:54 -0000\r\nReceived: from unknown (66.218.66.218)\n  by m9.grp.scd.yahoo.com with QMQP; 24 Apr 2003 01:06:54 -0000\r\nReceived: from unknown (HELO falcon.mail.pas.earthlink.net) (207.217.120.74)\n  by mta3.grp.scd.yahoo.com with SMTP; 24 Apr 2003 01:06:55 -0000\r\nReceived: from dialup-65.59.100.187.dial1.weehawken1.level3.net ([65.59.100.187] helo=oemcomputer)\n\tby falcon.mail.pas.earthlink.net with smtp (Exim 3.33 #1)\n\tid 198VCQ-0001qu-00\n\tfor nihontostudy@yahoogroups.com; Wed, 23 Apr 2003 18:06:55 -0700\r\nMessage-ID: &lt;015001c309fe$08409820$bb643b41@oemcomputer&gt;\r\nTo: &lt;nihontostudy@yahoogroups.com&gt;\r\nSubject: koshirae data file\r\nDate: Wed, 23 Apr 2003 21:08:34 -0400\r\nMIME-Version: 1.0\r\nX-Priority: 3\r\nX-MSMail-Priority: Normal\r\nX-Mailer: Microsoft Outlook Express 6.00.2800.1106\r\nX-MimeOLE: Produced By Microsoft MimeOLE V6.00.2800.1106\r\nFrom: &quot;Jim Gilbert&quot; &lt;jggilbert@...&gt;\r\nX-Yahoo-Group-Post: member; u=70790403\r\nX-Yahoo-Profile: yamaimojg\r\nContent-Type: text/plain; charset=US-ASCII\r\nContent-Transfer-Encoding: 7bit\r\n\r\nAfter Bob R. clued me in that there is a place to post non-photo files, I uploaded that Excel spreadsheet of koshirae stats to the group web site at:\n\nhttp://groups.yahoo.com/group/nihontostudy/files/\n\nIt&#39;s called katana koshirae.xls.  It opened in an Explorer browser window for me, but it probably won&#39;t play for non-Microsoft users.\n\nJim\n\n[Non-text portions of this message have been removed]\n\n\n"
}