{
    "userId": 70790403,
    "authorName": "Jim Gilbert",
    "from": "&quot;Jim Gilbert&quot; &lt;jggilbert@...&gt;",
    "profile": "yamaimojg",
    "replyTo": "LIST",
    "senderId": "8SKvuHvlAcs68EqF1byG6WUyVH9-4kCoduaLBDwrhhafT4kTyrokROks-eDxIKSuUSR3iqoaYxV_-iHqmH4VhgL6dAS_H1_qZVxyLWsl",
    "spamInfo": {
        "isSpam": false,
        "reason": "0"
    },
    "subject": "stolen sword alert",
    "postDate": "1051151881",
    "msgId": 37,
    "canDelete": false,
    "contentTrasformed": false,
    "systemMessage": false,
    "headers": {
        "messageIdInHeader": "PDAwMzgwMWMzMGEwYSQ4NzUyYjEwMCRmNDc3ZjVkMUBvZW1jb21wdXRlcj4="
    },
    "prevInTopic": 0,
    "nextInTopic": 38,
    "prevInTime": 36,
    "nextInTime": 38,
    "topicId": 37,
    "numMessagesInTopic": 10,
    "msgSnippet": "Please take a moment to look at the list below.  Let me know off line if you have any questions or comments. Thanks,  Jim ... This letter I would really prefer",
    "rawEmail": "Return-Path: &lt;jggilbert@...&gt;\r\nX-Sender: jggilbert@...\r\nX-Apparently-To: nihontostudy@yahoogroups.com\r\nReceived: (EGP: mail-8_2_6_5); 24 Apr 2003 02:36:26 -0000\r\nReceived: (qmail 46978 invoked from network); 24 Apr 2003 02:36:24 -0000\r\nReceived: from unknown (66.218.66.216)\n  by m10.grp.scd.yahoo.com with QMQP; 24 Apr 2003 02:36:24 -0000\r\nReceived: from unknown (HELO albatross.mail.pas.earthlink.net) (207.217.120.120)\n  by mta1.grp.scd.yahoo.com with SMTP; 24 Apr 2003 02:36:21 -0000\r\nReceived: from dialup-209.245.119.244.dial1.weehawken1.level3.net ([209.245.119.244] helo=oemcomputer)\n\tby albatross.mail.pas.earthlink.net with smtp (Exim 3.33 #1)\n\tid 198Waw-0007MF-00\n\tfor nihontostudy@yahoogroups.com; Wed, 23 Apr 2003 19:36:19 -0700\r\nMessage-ID: &lt;003801c30a0a$8752b100$f477f5d1@oemcomputer&gt;\r\nTo: &lt;nihontostudy@yahoogroups.com&gt;\r\nSubject: stolen sword alert\r\nDate: Wed, 23 Apr 2003 22:38:01 -0400\r\nMIME-Version: 1.0\r\nX-Priority: 3\r\nX-MSMail-Priority: Normal\r\nX-Mailer: Microsoft Outlook Express 6.00.2800.1106\r\nX-MimeOLE: Produced By Microsoft MimeOLE V6.00.2800.1106\r\nFrom: &quot;Jim Gilbert&quot; &lt;jggilbert@...&gt;\r\nX-Yahoo-Group-Post: member; u=70790403\r\nX-Yahoo-Profile: yamaimojg\r\nContent-Type: text/plain; charset=US-ASCII\r\nContent-Transfer-Encoding: 7bit\r\n\r\nPlease take a moment to look at the list below.  Let me know off line if you have any questions or comments.\n\nThanks,  Jim \n\n---------------------------------------------------------------------\n\nThis letter I would really prefer not being urged to write to you, because it is not the type of letters I would like to receive as well!\n\nSo, please be prepared to read a really bad message:\n\nOn Friday 4th of April a theft occurred in Basle, Switzerland. All of the swords of Mr. Indlekofer, who died last October, were stolen, together with gold coins and jewels.\n\nThe swords were:\n\n1.)    Den Senjuin, Juyo (23)Tanto, 25 cm\n\n2.)    DenTaima Juyo (12) Katana, 69,30 cm\n\n3.)    Kinzogan Mei Taima Juyo (37) Katana, 66.60 cm\n\n4.)    Aritoshi, Juyo (36)  Tachi, 78.70 cm\n\n5.)    Tegai, Juyo (35) Katana, 69.80 cm\n\n6.)    Hosho, Juyo (19) Katana 69.40 cm\n\n7.)    Den Shikkake, Juyo (17) Katana 70.90 cm\n\n8.)    Den Ryumon Nobuyoshi, Juyo (23) Katana, 70.60 cm (in Bizen style)\n\n9.)    Kinpunmei Ryumon Nobuyoshi, Juyo (11) Katana, 72.20 cm (in Yamato style)\n\n10.)  Omiya, Juyo (37) Katana, 69.60 cm\n\n11.)   Mitsumori (gakumei), Juyo (33) Wakizashi, 46,90 cm\n\n12.)    Kunimasa (Horikawa), Juyo (45) Katana, 70.55 cm\n\n13.)   Ushu Shonai Fujiwara Kiyondo, Ansei ni-nen, Efu ni-oite Kore-o tsukuru, 65,50 cm, Tokubetsu Hozon\n\n14.)   A Daisho (unknown makers)\n\n It would be very kind of you if you could publish this in your next publication for your Society, if anybody gets hints of those swords, please information either to me or to the Kriminalkommissariat Basel-Stadt, Tel. Switzerland 061 267 71 71.\n\n Many thanks in advance\n\nSincerely yours,\n\nMichael Hagenbusch\n\n\n[Non-text portions of this message have been removed]\n\n\n"
}