{
    "userId": 136909275,
    "authorName": "Curran Campbell",
    "from": "Curran Campbell &lt;neobliviscar@...&gt;",
    "profile": "neobliviscar",
    "replyTo": "LIST",
    "senderId": "fnVek53L3L-PHFn3fVQR71Muzxlcd54v3sigtMxlDeNBLv-nf28ogAe2dUeZhYCfnx-89ZyKTu5YpCoYXYrcAkP6OjoKIzdEBSON6OaB3A",
    "spamInfo": {
        "isSpam": false,
        "reason": "0"
    },
    "subject": "Kodogu:  Kaga Goto and Kaga Kinko",
    "postDate": "1309747686",
    "msgId": 5827,
    "canDelete": false,
    "contentTrasformed": false,
    "systemMessage": false,
    "headers": {
        "messageIdInHeader": "PDEzMDk3NDc2ODYuMTA5MjkuWWFob29NYWlsQ2xhc3NpY0B3ZWIxMzAyMTAubWFpbC5tdWQueWFob28uY29tPg=="
    },
    "prevInTopic": 0,
    "nextInTopic": 5828,
    "prevInTime": 5826,
    "nextInTime": 5828,
    "topicId": 5827,
    "numMessagesInTopic": 2,
    "msgSnippet": "Lists, I have had the Kaga Kinko Taikan for many years and recently purchased a quiet Maeda mon mitokoromono of Kaga work. I just passed on a nice Kaga Goto",
    "rawEmail": "Return-Path: &lt;neobliviscar@...&gt;\r\nX-Sender: neobliviscar@...\r\nX-Apparently-To: nihontostudy@yahoogroups.com\r\nX-Received: (qmail 64044 invoked from network); 4 Jul 2011 02:48:08 -0000\r\nX-Received: from unknown (98.137.34.45)\n  by m5.grp.sp2.yahoo.com with QMQP; 4 Jul 2011 02:48:08 -0000\r\nX-Received: from unknown (HELO nm1.bullet.mail.bf1.yahoo.com) (98.139.212.160)\n  by mta2.grp.sp2.yahoo.com with SMTP; 4 Jul 2011 02:48:08 -0000\r\nX-Received: from [98.139.212.152] by nm1.bullet.mail.bf1.yahoo.com with NNFMP; 04 Jul 2011 02:48:07 -0000\r\nX-Received: from [98.139.212.220] by tm9.bullet.mail.bf1.yahoo.com with NNFMP; 04 Jul 2011 02:48:07 -0000\r\nX-Received: from [127.0.0.1] by omp1029.mail.bf1.yahoo.com with NNFMP; 04 Jul 2011 02:48:07 -0000\r\nX-Yahoo-Newman-Property: ymail-3\r\nX-Yahoo-Newman-Id: 437576.67499.bm@...\r\nX-Received: (qmail 30023 invoked by uid 60001); 4 Jul 2011 02:48:07 -0000\r\nX-YMail-OSG: FpyGF2EVM1khjKLlG0oGS3l1afzlE5jHVvwiTIlarKkuRWB\n fKf.OzH9u_P2uEaTv.aE2xSfrfYUzRtaBd3uKL2MdUTrQv4p3gZVaOeaHvcY\n 0M_WBpJ1Btdy5.WTA_40O_.vtwtv9URcADVs373Hw9sTMwZ9uOu.djm8dI0r\n fMjHhHyu8.IgHel9G34R2YOUWFH_9Bw3Qr28ISS_88TJJcXaXc_C9i1xnqP.\n Kn7l5ChnT8n4v9ZI7EkOlSVQDwESI_VFRHaS2q7KkEJouej5cSnlcJNo8miV\n pzcM6KQko2CqhL37XjYXG7X6DeqTx7LUvz.TTL0lWKcWt6AVEsvaJ0goYhUm\n 2eWI6yHnOwoe4yGpqRlroKV8eFQdfbHnPfO3dAt.R.89_Tkl3TwAM_KLqLI_\n 3kkS4wbrPXN24\r\nX-Received: from [66.108.51.235] by web130210.mail.mud.yahoo.com via HTTP; Sun, 03 Jul 2011 19:48:06 PDT\r\nX-Mailer: YahooMailClassic/14.0.3 YahooMailWebService/0.8.112.307740\r\nMessage-ID: &lt;1309747686.10929.YahooMailClassic@...&gt;\r\nDate: Sun, 3 Jul 2011 19:48:06 -0700 (PDT)\r\nTo: token_kenkyu_kai@...\r\nCc: nihonto@yahoogroups.com, nihontostudy@yahoogroups.com\r\nMIME-Version: 1.0\r\nFrom: Curran Campbell &lt;neobliviscar@...&gt;\r\nSubject: Kodogu:  Kaga Goto and Kaga Kinko\r\nX-Yahoo-Group-Post: member; u=136909275; y=wtyyE2cRVScAZIqgw0ZHpkyGuYiB0jiVpmu0aMMzVqehHIPBqnSc\r\nX-Yahoo-Profile: neobliviscar\r\nContent-Type: text/plain; charset=US-ASCII\r\nContent-Transfer-Encoding: 7bit\r\n\r\nLists,\n\nI have had the Kaga Kinko Taikan for many years and recently purchased a quiet Maeda mon mitokoromono of Kaga work. I just passed on a nice Kaga Goto kozuka that I did like but felt was priced too high. It seems July would be a good month to devote to the study of Kaga Kinko.\n\nIf anyone has any papered Kaga Kinko or Kaga Goto items, I&#39;d love to see any pictures and share any insights into these works.\n\nI wish a good 4th of July to the USA members.\n\nCurran\nSarasota / NYC\n\n\n\n[Non-text portions of this message have been removed]\n\n\n"
}