{
    "userId": 134498325,
    "authorName": "tom helm",
    "from": "tom helm &lt;junkmail@...&gt;",
    "profile": "soshuju",
    "replyTo": "LIST",
    "senderId": "cfIk5XYifU_1uFflBHuMYGIOiHKkc3azsAU86CMyDemjKFh2t3fn1I7fd7eACV_3MKr9t5S0Hj7G6Ib3KM9S1Aa2eHs19SyQ",
    "spamInfo": {
        "isSpam": false,
        "reason": "0"
    },
    "subject": "stolen sword",
    "postDate": "1060148973",
    "msgId": 644,
    "canDelete": false,
    "contentTrasformed": false,
    "systemMessage": false,
    "headers": {
        "messageIdInHeader": "PGEwNTIxMDYwM2JiNTY0NTY4ODg3YkBbMTkyLjE2OC4xNzMuMTY2XT4="
    },
    "prevInTopic": 0,
    "nextInTopic": 0,
    "prevInTime": 643,
    "nextInTime": 645,
    "topicId": 644,
    "numMessagesInTopic": 1,
    "msgSnippet": "Posted recently to another list, please let us know if you encounter this sword. -t It is embarrassing for me to tell you that I have lost a valuable sword. It",
    "rawEmail": "Return-Path: &lt;toryu@...&gt;\r\nX-Sender: toryu@...\r\nX-Apparently-To: nihontostudy@yahoogroups.com\r\nReceived: (qmail 62660 invoked from network); 6 Aug 2003 05:49:37 -0000\r\nReceived: from unknown (66.218.66.216)\n  by m11.grp.scd.yahoo.com with QMQP; 6 Aug 2003 05:49:37 -0000\r\nReceived: from unknown (HELO pop.sanbrunocable.com) (65.172.230.120)\n  by mta1.grp.scd.yahoo.com with SMTP; 6 Aug 2003 05:49:37 -0000\r\nReceived: from [192.168.173.166] (dynamic-192-168-173-166.sanbrunocable.com [192.168.173.166])\n\tby pop.sanbrunocable.com (8.11.6/8.11.6) with ESMTP id h765nAL26577;\n\tTue, 5 Aug 2003 22:49:10 -0700\r\nMime-Version: 1.0\r\nX-Sender: sanbruno@...\r\nMessage-Id: &lt;a05210603bb564568887b@[192.168.173.166]&gt;\r\nDate: Tue, 5 Aug 2003 22:49:33 -0700\r\nTo: tom helm &lt;toryu@...&gt;\r\nSubject: stolen sword\r\nContent-Type: text/plain; charset=&quot;us-ascii&quot; ; format=&quot;flowed&quot;\r\nX-eGroups-From: tom helm &lt;toryu@...&gt;\r\nFrom: tom helm &lt;junkmail@...&gt;\r\nX-Yahoo-Group-Post: member; u=134498325\r\nX-Yahoo-Profile: soshuju\r\n\r\nPosted recently to another list, please let us know if you encounter \nthis sword.\n-t\n\nIt is embarrassing for me to tell you that I have lost a valuable sword.\nIt was sent Global Express Mail .  It was routed to Mexico instead of to\nTokyo, according to EMS in San Francisco. We are still awaiting response\nfrom Mexico but it should be shortly.\nIn the meantime if this has been lost or stolen someone may attempt to have\nit valued or try to sell it at the S.F. Taikai.\nIf approached please alert security.  I will be there with full description\nand oshigata and photo.\nShinsakuto signed: Musashi no Kuni ju Kato Chozaemon Sanehira saku\nDated: Showa 47, Feb. (1972)\n28.11 nagasa, width 1.38in  .79 sori\nhorimono: Bohi on both sides\nFull polish\nIn shirasaya, The saya is in an unusual  white cloth bag with tie string.\nIt was appraised at 480,000 yen or now something over $4000. dollars.\nYour help would be most appreciated.\n\nsincerely\nBill De La Grange\ngrange@...\n\n"
}