{
    "userId": 135018472,
    "authorName": "Matthew E. Hoyle",
    "from": "&quot;Matthew E. Hoyle&quot; &lt;matthewhoyle@...&gt;",
    "profile": "matthewhoyle2000",
    "replyTo": "LIST",
    "senderId": "whRIsXz5cWq_rwOe_NJM50nOdI1LE5MxxW78RV7Cz4ZJyacu76VmTowUjxGZe3HFgrbdaV0tRYjYlg9HLM-CQ0e4QIRVc28rtiOtRpYgMzexgA0",
    "spamInfo": {
        "isSpam": false,
        "reason": "0"
    },
    "subject": "Animals on tsuba",
    "postDate": "1051389379",
    "msgId": 77,
    "canDelete": false,
    "contentTrasformed": false,
    "systemMessage": false,
    "headers": {
        "messageIdInHeader": "PDAwNGUwMWMzMGMzMyQ4MTU3NjY4MCQ5N2NhZmVhOUBreXA0Pg=="
    },
    "prevInTopic": 0,
    "nextInTopic": 78,
    "prevInTime": 76,
    "nextInTime": 78,
    "topicId": 77,
    "numMessagesInTopic": 13,
    "msgSnippet": "Hi guys, Does anyone have a book or a list of all the different animals found on tsuba and other sword furniture, and their meaning ? I know quite alot about",
    "rawEmail": "Return-Path: &lt;MatthewHoyle@...&gt;\r\nX-Sender: MatthewHoyle@...\r\nX-Apparently-To: nihontostudy@yahoogroups.com\r\nReceived: (EGP: mail-8_2_6_6); 26 Apr 2003 20:36:36 -0000\r\nReceived: (qmail 89044 invoked from network); 26 Apr 2003 20:36:35 -0000\r\nReceived: from unknown (66.218.66.218)\n  by m10.grp.scd.yahoo.com with QMQP; 26 Apr 2003 20:36:35 -0000\r\nReceived: from unknown (HELO smtp4.wanadoo.nl) (194.134.35.175)\n  by mta3.grp.scd.yahoo.com with SMTP; 26 Apr 2003 20:36:35 -0000\r\nReceived: from kyp4 (3eea2af2.cable.wanadoo.nl [62.234.42.242])\n\tby smtp4.wanadoo.nl (Postfix) with ESMTP id D5EF23EAAF\n\tfor &lt;nihontostudy@yahoogroups.com&gt;; Sat, 26 Apr 2003 22:36:32 +0200 (CEST)\r\nTo: &lt;nihontostudy@yahoogroups.com&gt;\r\nSubject: Animals on tsuba\r\nDate: Sat, 26 Apr 2003 22:36:19 +0200\r\nMessage-ID: &lt;004e01c30c33$81576680$97cafea9@kyp4&gt;\r\nMIME-Version: 1.0\r\nX-Priority: 3 (Normal)\r\nX-MSMail-Priority: Normal\r\nX-Mailer: Microsoft Outlook, Build 10.0.2627\r\nX-MimeOLE: Produced By Microsoft MimeOLE V6.00.2600.0000\r\nImportance: Normal\r\nFrom: &quot;Matthew E. Hoyle&quot; &lt;matthewhoyle@...&gt;\r\nX-Yahoo-Group-Post: member; u=135018472\r\nX-Yahoo-Profile: matthewhoyle2000\r\nContent-Type: text/plain; charset=US-ASCII\r\nContent-Transfer-Encoding: 7bit\r\n\r\nHi guys,\n \nDoes anyone have a book or a list of all the different animals found on\ntsuba and other sword furniture, and their meaning ?\n \nI know quite alot about symbolism in Chinese art, but so far they seem\nto be quite different to the Japanese. \n \n- Matt\n\n\n[Non-text portions of this message have been removed]\n\n\n"
}