{
    "userId": 122856650,
    "authorName": "Richard Turner",
    "from": "&quot;Richard Turner&quot; &lt;ikkanshi@...&gt;",
    "profile": "retalt",
    "replyTo": "LIST",
    "senderId": "bUJWTPtHFzYtjNwQF4llHypqT2QS3gSqgE-qyBUBGwqwplMyeA-2B5aolSEO3XSfJX16QvC6K5yyU5UBqqEIjE3iP7N_BwLVbtKsJGTWG9ju",
    "spamInfo": {
        "isSpam": false,
        "reason": "0"
    },
    "subject": "Re: [nihontostudy] Surf&#39;s Up",
    "postDate": "1051410359",
    "msgId": 85,
    "canDelete": false,
    "contentTrasformed": false,
    "systemMessage": false,
    "headers": {
        "messageIdInHeader": "PDAwM2UwMWMzMGM2NCQ1N2Q1ZDQwMCQwMzAwYThjMEByaWNoYXJkPg==",
        "referencesHeader": "PEUxOTlYMGUtMDAwMlE4LTAwQGhhd2subWFpbC5wYXMuZWFydGhsaW5rLm5ldD4gPEUxOTlYS1AtMDAwMmFELTAwQGhhd2subWFpbC5wYXMuZWFydGhsaW5rLm5ldD4gPDAwMWEwMWMzMGM1OCRjNjBmZGU5MCQwMzAwYThjMEByaWNoYXJkPiA8YTA1MTExYjAwYmFkMGVjYTU0MDVjQFs2NS4xNzIuMjM5LjQ4XT4="
    },
    "prevInTopic": 84,
    "nextInTopic": 0,
    "prevInTime": 84,
    "nextInTime": 86,
    "topicId": 83,
    "numMessagesInTopic": 3,
    "msgSnippet": "mmm, of course, due to lack of information, Nakago, Kissaki, Sugata etc etc. clever me. I was just trying to place a school to this hamon if in fact it is",
    "rawEmail": "Return-Path: &lt;ikkanshi@...&gt;\r\nX-Sender: ikkanshi@...\r\nX-Apparently-To: nihontostudy@yahoogroups.com\r\nReceived: (EGP: mail-8_2_6_6); 27 Apr 2003 02:27:54 -0000\r\nReceived: (qmail 4196 invoked from network); 27 Apr 2003 02:27:53 -0000\r\nReceived: from unknown (66.218.66.217)\n  by m8.grp.scd.yahoo.com with QMQP; 27 Apr 2003 02:27:53 -0000\r\nReceived: from unknown (HELO mail.iinet.net.au) (203.59.3.34)\n  by mta2.grp.scd.yahoo.com with SMTP; 27 Apr 2003 02:27:53 -0000\r\nReceived: (qmail 31014 invoked from network); 27 Apr 2003 02:26:14 -0000\r\nReceived: from unknown (HELO richard) (203.59.58.226)\n  by mail.iinet.net.au with SMTP; 27 Apr 2003 02:26:14 -0000\r\nMessage-ID: &lt;003e01c30c64$57d5d400$0300a8c0@richard&gt;\r\nTo: &lt;nihontostudy@yahoogroups.com&gt;\r\nReferences: &lt;E199X0e-0002Q8-00@...&gt; &lt;E199XKP-0002aD-00@...&gt; &lt;001a01c30c58$c60fde90$0300a8c0@richard&gt; &lt;a05111b00bad0eca5405c@[65.172.239.48]&gt;\r\nSubject: Re: [nihontostudy] Surf&#39;s Up\r\nDate: Sun, 27 Apr 2003 10:25:59 +0800\r\nMIME-Version: 1.0\r\nX-Priority: 3\r\nX-MSMail-Priority: Normal\r\nX-Mailer: Microsoft Outlook Express 6.00.2800.1106\r\nX-MimeOLE: Produced By Microsoft MimeOLE V6.00.2800.1106\r\nFrom: &quot;Richard Turner&quot; &lt;ikkanshi@...&gt;\r\nX-Yahoo-Group-Post: member; u=122856650\r\nX-Yahoo-Profile: retalt\r\nContent-Type: text/plain; charset=US-ASCII\r\nContent-Transfer-Encoding: 7bit\r\n\r\nmmm, of course, due to lack of information, Nakago, Kissaki, Sugata etc etc. \n\nclever me. I was just trying to place a school to this hamon if in fact it is A-Typical of any school or schools\n\nRich\n  ----- Original Message ----- \n  From: tom helm \n  To: nihontostudy@yahoogroups.com \n  Sent: Sunday, April 27, 2003 10:11 AM\n  Subject: Re: [nihontostudy] Surf&#39;s Up\n\n\n  No way Rich...\n\n  -t\n\n  [Non-text portions of this message have been removed]\n\n\n        Yahoo! Groups Sponsor \n       \n       \n\n  To unsubscribe from this group, send an email to:\n  nihontostudy-unsubscribe@yahoogroups.com\n\n\n\n  Your use of Yahoo! Groups is subject to the Yahoo! Terms of Service. \n\n\n[Non-text portions of this message have been removed]\n\n\n"
}