{
    "userId": 27642611,
    "authorName": "Richard George",
    "from": "Richard George &lt;rkg@...&gt;",
    "profile": "rkgatteleport",
    "replyTo": "LIST",
    "senderId": "3icJmplj2wtTojj6qoA5mpnCQ15DZ-kZ4j3HF_m-h4BW1-xV27a2QAckbP3IQ-AYbQw7jcGPJirEIqXJwyHjyfP2WCDAeA2-",
    "spamInfo": {
        "isSpam": false,
        "reason": "0"
    },
    "subject": "Is anybody out there?  or - test please disregard",
    "postDate": "1051486874",
    "msgId": 88,
    "canDelete": false,
    "contentTrasformed": false,
    "systemMessage": false,
    "headers": {
        "messageIdInHeader": "PDNFQUM2QTlBLjMwMDA4MDBAdGVsZXBvcnQuY29tPg=="
    },
    "prevInTopic": 0,
    "nextInTopic": 89,
    "prevInTime": 87,
    "nextInTime": 89,
    "topicId": 88,
    "numMessagesInTopic": 4,
    "msgSnippet": "Hi, I hadn t seen anything posted to this list for a couple of days and assumed the worst... thanks, rkg (Richard George)",
    "rawEmail": "Return-Path: &lt;rkg@...&gt;\r\nX-Sender: rkg@...\r\nX-Apparently-To: nihontostudy@yahoogroups.com\r\nReceived: (EGP: mail-8_2_6_6); 27 Apr 2003 23:40:31 -0000\r\nReceived: (qmail 712 invoked from network); 27 Apr 2003 23:40:31 -0000\r\nReceived: from unknown (66.218.66.217)\n  by m6.grp.scd.yahoo.com with QMQP; 27 Apr 2003 23:40:31 -0000\r\nReceived: from unknown (HELO capitol.mail.pas.earthlink.net) (207.217.120.180)\n  by mta2.grp.scd.yahoo.com with SMTP; 27 Apr 2003 23:40:30 -0000\r\nReceived: from apx1-10-170.pdx.du.teleport.com ([216.26.8.170] helo=teleport.com)\n\tby capitol.mail.pas.earthlink.net with esmtp (Exim 3.33 #1)\n\tid 199vl0-00047L-00\n\tfor nihontostudy@yahoogroups.com; Sun, 27 Apr 2003 16:40:30 -0700\r\nMessage-ID: &lt;3EAC6A9A.3000800@...&gt;\r\nDate: Sun, 27 Apr 2003 16:41:14 -0700\r\nUser-Agent: Mozilla/5.0 (Windows; U; Windows NT 5.1; en-US; rv:0.9.4) Gecko/20011128 Netscape6/6.2.1 (CPQCA2C02)\r\nX-Accept-Language: en-us\r\nMIME-Version: 1.0\r\nTo: nihontostudy@yahoogroups.com\r\nSubject: Is anybody out there?  or - test please disregard\r\nContent-Type: text/plain; charset=us-ascii; format=flowed\r\nContent-Transfer-Encoding: 7bit\r\nFrom: Richard George &lt;rkg@...&gt;\r\nX-Yahoo-Group-Post: member; u=27642611\r\nX-Yahoo-Profile: rkgatteleport\r\n\r\nHi,\n\nI hadn&#39;t seen anything posted to this list for a couple of days and \nassumed the worst...\n\nthanks,\n\nrkg\n(Richard George)\n\n\n\n"
}