{
    "userId": 145265958,
    "authorName": "Jinsoo Kim",
    "from": "&quot;Jinsoo Kim&quot; &lt;jinsoo.kim@...&gt;",
    "profile": "leonkim",
    "replyTo": "LIST",
    "senderId": "hIw5c-A8DJR8Y5MXQQKsNvhPGRAy9PzarSj3r6NFgphm4mpv7rWGPh21Gy24howhhduwbjYr5hU8Kup5dMxkTxAG8lNsvXdfcasX6rnIDw",
    "spamInfo": {
        "isSpam": false,
        "reason": "0"
    },
    "subject": "Good launch",
    "postDate": "1051072306",
    "msgId": 9,
    "canDelete": false,
    "contentTrasformed": false,
    "systemMessage": false,
    "headers": {
        "messageIdInHeader": "PGI4NTR2aSt0NDJrQGVHcm91cHMuY29tPg=="
    },
    "prevInTopic": 0,
    "nextInTopic": 0,
    "prevInTime": 8,
    "nextInTime": 10,
    "topicId": 9,
    "numMessagesInTopic": 1,
    "msgSnippet": "Good job, Jim. I hope we discuss and share Nihonto knowledge here and strongly restrict the eligibility of membership. Jinsoo",
    "rawEmail": "Return-Path: &lt;jinsoo.kim@...&gt;\r\nX-Sender: jinsoo.kim@...\r\nX-Apparently-To: nihontostudy@yahoogroups.com\r\nReceived: (EGP: mail-8_2_6_5); 23 Apr 2003 04:31:53 -0000\r\nReceived: (qmail 56640 invoked from network); 23 Apr 2003 04:31:53 -0000\r\nReceived: from unknown (66.218.66.217)\n  by m11.grp.scd.yahoo.com with QMQP; 23 Apr 2003 04:31:53 -0000\r\nReceived: from unknown (HELO n27.grp.scd.yahoo.com) (66.218.66.83)\n  by mta2.grp.scd.yahoo.com with SMTP; 23 Apr 2003 04:31:52 -0000\r\nReceived: from [66.218.67.252] by n27.grp.scd.yahoo.com with NNFMP; 23 Apr 2003 04:31:49 -0000\r\nDate: Wed, 23 Apr 2003 04:31:46 -0000\r\nTo: nihontostudy@yahoogroups.com\r\nSubject: Good launch\r\nMessage-ID: &lt;b854vi+t42k@...&gt;\r\nUser-Agent: eGroups-EW/0.82\r\nMIME-Version: 1.0\r\nContent-Type: text/plain; charset=ISO-8859-1\r\nContent-Length: 131\r\nX-Mailer: Yahoo Groups Message Poster\r\nFrom: &quot;Jinsoo Kim&quot; &lt;jinsoo.kim@...&gt;\r\nX-Yahoo-Group-Post: member; u=145265958\r\nX-Yahoo-Profile: leonkim\r\n\r\nGood job, Jim.\n\nI hope we discuss and share Nihonto knowledge here and strongly \nrestrict the eligibility of membership. \n\nJinsoo \n\n\n"
}